{
  "span_id": "61924f70-cb6e-5309-9533-1b8a533a5fca",
  "document_id": "e0f67c69-0a26-5724-ad91-9470af534f38",
  "source_tier": 1,
  "source_type": "official_api_response",
  "url": "https://knesset.gov.il/Odata/ParliamentInfo.svc/KNS_Person?$format=json&$filter=PersonID eq 48&$top=1",
  "archive_uri": "minio://civic-archive/knesset/by-sha256/ed/ed6ba78a7b75bc14f20d7504453c5882dcadd64a47fa4a0c41174c01a82ed880.json",
  "text": "\"PersonID\":48",
  "char_start": 99,
  "char_end": 112,
  "captured_at": "2026-04-23T19:38:05Z"
}
